{
  "ad_id": "wiom_001",
  "date_reviewed": "2026-03-28",
  "campaign_objective": "default",
  "weight_profile": {
    "hook": 0.3,
    "retention": 0.25,
    "ctr_drivers": 0.2,
    "cta_conversion": 0.15,
    "brand_coherence": 0.1
  },
  "dimensions": {
    "hook": {
      "score": 3,
      "what_ad_does": "Opens with a production title card (OFFLINE SEC), then cuts to a young woman smiling at her phone in a small-town setting. The family scene develops gradually — mother talking animatedly near an auto-rickshaw. No immediate curiosity gap or pattern interrupt in the first 3 seconds.",
      "pattern_match": "Partially matches C1 (no brand-first opening — brand only appears in end card). Does NOT match C2 (no curiosity engine — no open question or escalating tension in the opener). The title card is a dead first 3 seconds for feed viewing.",
      "gap": "The hook lacks a scroll-stopping moment. No relatable problem statement, no visual surprise, no curiosity gap. The viewer has to invest 10+ seconds before anything intriguing happens (the mother's animated conversation). For feed platforms, this means losing 60-70% of viewers before the story even starts.",
      "reference_ad_id": "ad_010"
    },
    "retention": {
      "score": 3,
      "what_ad_does": "49-second narrative with a dialogue-driven through-line. Family cancels services → auto-rickshaw ride → driver asks about internet → product concept explained via meter analogy. The auto driver's entry at ~35s (71% mark) is the closest thing to a pattern interrupt.",
      "pattern_match": "Partially matches C2 (the 'what is ghar ka net?' question from the driver creates a mild open loop). Does NOT match C3 (49s is in the dead zone — too long for feed, not long enough for deep emotional narrative like ad_007 Cadbury or ad_010 Adani at 60s). Pattern interrupt at 71% is too late for C4 (should be 40-60%).",
      "gap": "The pace is conversational throughout — no tonal shift, no energy change, no escalation. Viewers who stay past the hook encounter pleasant but undifferentiated dialogue scenes. The auto driver's curiosity is the strongest retention element but arrives too late. The 49s duration doesn't justify itself the way a 60s emotional narrative does.",
      "reference_ad_id": "ad_007"
    },
    "ctr_drivers": {
      "score": 2,
      "what_ad_does": "Entirely dialogue-driven with no text overlays until the end card. No visual CTA elements. The story does logically lead to the product (matches K1 partially — the meter analogy is narrative-connected). Zero sound-off survivability — without audio, this is just people talking near an auto-rickshaw.",
      "pattern_match": "Partially matches K1 (the CTA/tagline feels like a narrative conclusion, not an appended ask). Completely fails K2 (sound-off survivability). On Meta where 85% of videos are watched without sound, this ad communicates nothing. No text overlays, no visual storytelling that works silent.",
      "gap": "Critical gap for Meta/Instagram placement. The ad was designed for TV/YouTube (sound-on contexts) but Wiom needs feed performance. Adding bold Hindi text overlays at key moments (the question, the meter analogy, the tagline) would make this work across all platforms without hurting the narrative.",
      "reference_ad_id": "ad_002"
    },
    "cta_conversion": {
      "score": 2,
      "what_ad_does": "End card shows tagline 'Wiom — Pure ghar ka net, jitna use karo, bass utna bharo' over a wide shot of the street. No download prompt, no app mention, no QR code, no specific action requested. The tagline is memorable and narrative-connected but is a brand sign-off, not a call to action.",
      "pattern_match": "The tagline is narrative-earned (the whole ad builds to this concept), which aligns with K1. But there is literally no CTA — no 'Download Wiom', no 'Try free for 7 days', no 'Switch now'. The best-in-class ads all have specific, actionable CTAs. This has a slogan.",
      "gap": "The ad does all the work of building desire and understanding but fails to convert that into action. Adding a specific CTA ('Download Wiom — first month free' or 'Try Wiom free — jitna use karo') that extends the narrative metaphor would dramatically improve conversion potential. Urgency element completely absent.",
      "reference_ad_id": "ad_009"
    },
    "brand_coherence": {
      "score": 4,
      "what_ad_does": "Brand appears only in the end card — delayed reveal that avoids ad-skip instinct. The setting (small-town India, auto-rickshaw, family of 4-5, school-uniform kid) perfectly mirrors Wiom's Tier 2-3 target. The auto-meter analogy is culturally resonant and distinctive. Pure Hindi in authentic small-town register. TVF production quality is high but grounded.",
      "pattern_match": "Strong match with the cultural authenticity standard. The auto-meter analogy is a brand asset — it explains a complex concept (metered broadband) through something every Indian understands. Casting and setting feel real, not aspirational-urban. This is exactly the cultural register the playbook emphasizes (anti-pattern X5 avoided completely).",
      "gap": "Minor gap: the brand voice is established here but may not be consistent across other Wiom ads. The end card is text-only — a brief logo animation or audio sting would build brand recall across a campaign. The ad doesn't quite have a 'distinctive aesthetic' that's instantly recognizable as Wiom.",
      "reference_ad_id": null
    }
  },
  "overall_score": 55,
  "anti_patterns_triggered": [
    {
      "name": "X3 — Flat Energy (partial)",
      "description": "The ad maintains a consistent conversational tone throughout. No dramatic pace change, no energy shift, no tonal surprise. The auto driver's entry provides mild interest but not a true pattern interrupt. The energy is pleasant but never spikes."
    },
    {
      "name": "X4 — No CTA (worse than generic)",
      "description": "The ad has no call to action at all. Not even a generic 'Learn More'. The tagline is strong but a tagline is not a CTA. There is no prompt for the viewer to do anything after watching."
    }
  ],
  "strengths": [
    "Perfect cultural register for Tier 2-3 India — authentic setting, casting, and Hindi dialect that Wiom's audience will recognize as their own world",
    "The auto-meter analogy is a brilliant commodity-to-emotion reframe (D1) — it makes 'metered broadband' instantly understandable through something every Indian knows",
    "Family as protagonist (D2) with 4-5 members matches the exact household Wiom targets",
    "No brand-first opening (avoids X1) — Wiom appears only at the end, letting the story do the work",
    "TVF production quality gives the ad credibility without feeling corporate or inauthentic"
  ],
  "priority_gaps": [
    {
      "dimension": "ctr_drivers",
      "impact_score": 9,
      "description": "Zero sound-off survivability. On Meta (85% sound-off viewing), this ad communicates nothing. Adding text overlays at 3-4 key moments would make the ad work across all platforms."
    },
    {
      "dimension": "cta_conversion",
      "impact_score": 8,
      "description": "No call to action exists. The ad builds understanding and desire but gives the viewer nowhere to go. A specific, narrative-connected CTA (app download, free trial) would convert completers into action-takers."
    },
    {
      "dimension": "hook",
      "impact_score": 7,
      "description": "The first 3-5 seconds (title card + woman on phone) don't create enough curiosity or relatability to stop the scroll. For feed placement, the hook needs to be dramatically stronger."
    },
    {
      "dimension": "retention",
      "impact_score": 5,
      "description": "49s duration is in the dead zone — neither tight enough for feed (30s) nor earned for long-form (60s). Consider a 30s cut for feed that preserves the auto-meter analogy as the core."
    }
  ]
}