{
  "ad_id": "wiom_002",
  "context_id": "ctx_002",
  "version": 2,
  "date_reviewed": "2026-03-31",
  "campaign_objective": "app_download",
  "weight_profile": {
    "hook": 0.2,
    "retention": 0.15,
    "ctr_drivers": 0.2,
    "cta_conversion": 0.35,
    "brand_coherence": 0.1
  },
  "dimensions": {
    "hook": {
      "score": 5,
      "what_ad_does": "Grabs attention with a multi-character emotional scene and a question",
      "pattern_match": "C1 Open with Recognition, Not Brand",
      "gap": "None",
      "reference_ad_id": null
    },
    "retention": {
      "score": 4,
      "what_ad_does": "Builds tension with a concise narrative and fast pacing",
      "pattern_match": "C2 Curiosity Engine — Open Loops and Escalation",
      "gap": "Abrupt ending might reduce retention",
      "reference_ad_id": null
    },
    "ctr_drivers": {
      "score": 4,
      "what_ad_does": "Creates curiosity with a question and emotional music",
      "pattern_match": "C2 Curiosity Engine — Open Loops and Escalation",
      "gap": "Lack of clear call-to-action earlier in the ad",
      "reference_ad_id": null
    },
    "cta_conversion": {
      "score": 3,
      "what_ad_does": "Clear CTA, but appears late in the ad",
      "pattern_match": "K1 Earned CTA — Story Logic Leads to Action",
      "gap": "CTA could be more prominent and urgent",
      "reference_ad_id": null
    },
    "brand_coherence": {
      "score": 3,
      "what_ad_does": "Consistent brand voice, but logo only visible at the end",
      "pattern_match": "D1 Commodity-to-Emotion Reframe",
      "gap": "Brand logo could be more prominent throughout the ad",
      "reference_ad_id": null
    }
  },
  "overall_score": 75.0,
  "anti_patterns_triggered": [
    {
      "name": "X3 Flat Energy / No Pattern Interrupt",
      "description": "The ad's pacing is fast, but the energy remains consistent throughout, which might make it less engaging for some viewers"
    }
  ],
  "strengths": [
    "Effective hook with a multi-character emotional scene and a question",
    "Concise narrative and fast pacing",
    "Clear CTA and consistent brand voice"
  ],
  "priority_gaps": [
    {
      "dimension": "retention",
      "impact_score": 8,
      "description": "Abrupt ending might reduce retention, consider adding a more satisfying conclusion"
    },
    {
      "dimension": "cta_conversion",
      "impact_score": 7,
      "description": "CTA could be more prominent and urgent, consider adding a sense of urgency or scarcity"
    },
    {
      "dimension": "brand_coherence",
      "impact_score": 6,
      "description": "Brand logo could be more prominent throughout the ad, consider adding a more visible logo or brand identifier"
    }
  ],
  "brief_alignment": null
}